#Económico,Denominación Aplicación Ingresos,C.DEFINITVO,DRN NETOS
11201,Impuesto B. Inmuebles naturaleza rústica,292239.91,295055.52
11202,Impuesto B. Inmuebles naturaleza urbana,43945678.72,43958133.35
11203,Impuesto características especiales,475487.07,469433.53
11301,Impuesto sobre vehículos tracción mecánica,16375000.0,15785209.6
11401,Impuesto sobre incremento valor terrenos,15150000.0,7576992.26
13001,Impuesto sobre actividades económicas,14742000.0,488304.62
13002,Participación en cuotas provinciales y estatales,1450000.0,0.0
28201,Impuestos sobre construcciones e instalaciones,8180000.0,4615101.35
28301,Aprovechamiento del coto de caza,2111.0,0.0
30001,Venta de efectos no utilizables,40000.0,3219.9
30002,Venta de publicaciones e impresos,1000.0,6404.84
30004,Venta de bienes y efectos en Montehermoso,5000.0,1380.65
30006,Venta de energía eléctrica,3000.0,0.0
30007,Ingresos oficina de turismo,25000.0,11198.9
31001,Recogida y eliminación de basuras,11118000.0,36085.08
31003,Servicios funerarios,650000.0,693342.87
31004,"Expedición de informes, atestados, fotocopias, planos y similares",288456.0,90792.58
31005,Retirada de vehículos de la vía pública,315241.2,234536.17
31008,Servicio de prevención y extinción de incendios,6181.2,1652.82
31013,Vertido de residuos en vertedero de Gardelegi,4264000.0,1830225.91
31020,Evacuación de consultas urbanísticas,15453.0,4964.65
31021,Vertido de aguas residuales no domésticas,337400.8,295614.81
31022,Duplicado TMC,10508.04,2144.0
31023,Transporte de energía,151500.0,0.0
31026,Prestación servicios salud pública,262701.0,48286.93
31027,Tasas de exámenes,7211.4,0.0
31028,Planta biocompost,772650.0,0.0
31029,Recogida selectiva de envases y residuos,1723060.0,1423390.84
31101,Licencias de apertura de establecimientos,300000.0,144365.18
31105,OTA,0.0,112.76
31201,Otorgamiento de licencias urbanísticas,309060.0,185497.95
32001,OTA - estacionamiento de vehículos en vías públicas,1989000.0,820602.7
32005,Cesiones de terrenos cementerio El Salvador,206856.0,104780.66
32102,Quioscos en vía pública,2575.5,678.69
32103,"Vallas, andamios, contenedores, material construcción, en vía pública",0.0,273189.37
32104,Veladores en vía pública,335320.0,3063.12
32105,Instalaciones en vía pública,669630.0,57527.27
32107,Apertura de calicatas y zanjas,515100.0,12823.74
32109,"Ocupación del suelo, subsuelo y vuelo por empresas de suministros",4950000.0,12987.78
32110,Ocupación del suelo empresas explotadoras servicios y suministro,0.0,1877924.96
32111,"Utilización del Palacio de Congresos, Principal, Pza toros...",153000.0,0.0
32112,Utilización de salas en centros cívicos,30906.0,72180.13
32113,Uso salas en centro empresas Júndiz,10302.0,3303.43
32114,Uso espacios en CSM,1030.2,-485.03
32201,Entrada de vehículos por las aceras y reservas de la vía pÚblica para aparcamien,1612000.0,771530.77
34000,Prestación de servicios SSAA municipales,700000.0,0.0
34001,Talleres salud pública,31824.0,10609.59
34002,"Escuelas infantiles,colonias abiertas y rincones de juego",669630.0,128349.18
34004,Asistencia a domicilio 3ª edad,681750.0,634420.12
34005,Estancias residencias 3ª edad,4534900.0,1493608.45
34006,Talleres de intervención social,72114.0,1549.87
34007,Formación ocupacional,51510.0,18620.62
34008,Abono instalaciones Mendizorrotza,6385600.0,6304226.51
34009,Abonos temporales y de temporada (Gamarra),171600.0,132.85
34010,Utilización instalaciones deportivas (reserva y venta),1320800.0,229822.33
34012,Matrículas en la Academia Mpal. de Folklore,153387.6,37492.97
34013,Cursos y talleres de cultura,318240.0,49066.52
34014,Taquillas  teatro,848400.0,203658.04
34015,Prestación de servicios de ludotecas,6758.11,649.8
34016,Préstamos de material audiovisual e iluminación de Juventud,8241.6,613.28
34018,Talleres de Presidencia,293607.0,16687.65
34020,Abonados a campañas deportivas,1424800.0,91985.62
34023,Estancia en el C.A.M.A.S,41208.0,31587.49
34025,Comidas centro socioculturales de mayores,505000.0,79016.97
34026,Liquidación estancias en residencias 3ª edad,63125.0,6372.58
34029,Cursos y actividades formativas,0.0,10518.09
34032,Venta de entradas Presidencia,0.0,4419.72
34038,Servicio de bodas,30300.0,3052.6
34039,Compensación gastos de gestión,1010000.0,0.0
34040,Ingresos Estación de Autobuses,646400.0,77081.99
34041,Uso parcelas huertos urbanos,0.0,7094.13
34043,Ingresos aparcamiento seguros de bicicletas,0.0,4170.32
36003,Cuota UNESPA y compañías no conveniadas,1040000.0,0.0
36100,Extinción incendios - cuota UNESPA y cías no conveniadas,0.0,-25133.8
38001,Reintegro por pagos,700000.0,359442.48
38002,Reintegros gastos por publicaciones en anuncios,50000.0,6682.09
38003,Reintegro de gastos o indemnizaciones de cías. aseguradoras,29251.0,29255.56
38004,Reintegros por costas de la vía de apremio,8000.0,0.0
38005,Reintegro indemnizaciones vía judicial,15000.0,0.0
38007,Reintegro explotaciones de servicios,71035.0,0.0
38008,Reintegro explotaciones de servicios,0.0,50466.58
39101,Multas por infracciones de tráfico,5480000.0,2239836.92
39102,Ingresos por procedimientos sancionadores,805420.0,1102919.91
39104,Sanciones por condiciones higiénico sanitarias de locales,100000.0,0.0
39201,Recargos de apremio,950000.0,323823.06
39401,Daños en vía pública por accidentes de vehículos,100000.0,24212.1
39402,Daños en bienes mpales. por actos vandálicos,7500.0,3743.14
39404,Ingresos ejecuciones subsidiarias,90000.0,-69805.8
39405,Ingresos derivados de costas judiciales,25000.0,120.94
39601,Ingresos  empresas de telefonía,1000000.0,438955.4
39901,Donativos,2000.0,0.0
39902,Otros ingresos diversos,50000.0,-195.85
39903,Intereses demora ejercicios anteriores,4000.0,0.0
39906,Donativos Belén de La Florida,15405.33,15301.8
39907,Ingresos rifa San Antón,1.0,13021.3
39909,Participacion ingresos aparcamientos,40000.0,0.0
40000,De la Admón. General,459389.78,0.0
41000,Del Gobierno Vasco,19787036.7,6291347.15
42000,De la Diputación Foral de Alava,9228793.2,1347298.47
42001,FOFEL,177063344.94,88641164.63
42003,Impuestos no concertados,300000.0,4871.54
43000,Entes públicos dentro término mpal,10000.0,0.0
48000,De familias,130000.0,3000.0
49000,De entes de la Unión Europea,209593.59,0.0
52500,Intereses en cajas y bancos Ayuntamiento,5000.0,0.0
54001,Rentas arrendamientos fincas urbanas ayto,135000.0,13814.54
54002,Arrendamiento locales semillero de empresas,125000.0,35891.4
54003,Explotación serv hostelería inmueble map,25000.0,0.0
54004,Expl.serv.hostelería en inmuebles municipales,0.0,22753.81
55000,Productos de concesiones,800000.0,287670.26
55902,Concesión explotación publicidad marquesinas,150000.0,0.0
59002,Utilización de terrenos,40000.0,38914.96
60300,Venta de terrenos PMS (incluídos honorarios de proy básicos),250000.0,506.51
60900,De terrenos-enajenación de parcelas municipales,5191532.94,0.0
61200,De edificios y otras construcciones,537000.0,0.0
65000,Plusvalías construcción viviendas en Dato - Gral Alava,976694.0,0.0
71000,Del Gobierno Vasco,21524326.46,0.0
72000,De la Diputación Foral de Alava,9741486.1,0.0
73000,Entes públicos dentro término municipal,25000.0,0.0
87200,RTGG remanente tesorería para gastos generales,13349472.74,0.0
87201,RTGFA remanente tesorería gastos con financiación afectada,21255269.78,0.0
93301,Préstamos para la financiación de inversiones,10750000.0,0.0
